{
  "schema_version": 1,
  "id": "upnp",
  "name": "UPnP",
  "summary": "Play to {player} from UPnP apps on your network.",
  "description": "Makes Kalinka Player appear as a UPnP renderer on your network, so UPnP control apps can play through the output selected in Kalinka Player.",
  "distribution": "kalinka-plugin-upnp",
  "entry_point": "kalinka_plugin_upnp",
  "creator": {"name": "Dmitry Savin", "url": "https://github.com/madenvel"},
  "maintainers": [{"name": "Kalinka Player", "url": "https://github.com/Kalinka-Player"}],
  "license": "GPL-3.0-or-later",
  "source": {"repository": "https://github.com/Kalinka-Player/KalinkaPlayer", "subdirectory": "packages/kalinka-plugin-upnp"},
  "tier": "unofficial",
  "maturity": "stable",
  "type": "input_module",
  "categories": ["network-audio"],
  "delivery": "bundle",
  "releases": []
}
