{
  "schema_version": 1,
  "id": "tidal",
  "name": "TIDAL",
  "summary": "Browse and play TIDAL on {player}.",
  "description": "Browse your TIDAL collection and personalized mixes, search for music, and play supported streams in Kalinka Player. Sign in with your TIDAL account; playback requires a subscription. Uses the unofficial tidalapi client and is not made or endorsed by TIDAL.",
  "distribution": "kalinka-plugin-tidal",
  "entry_point": "kalinka_plugin_tidal",
  "creator": {"name": "Dmitry Savin", "url": "https://github.com/madenvel"},
  "maintainers": [{"name": "Kalinka Player", "url": "https://github.com/Kalinka-Player"}],
  "license": "GPL-3.0-or-later",
  "source": {"repository": "https://github.com/Kalinka-Player/kalinka-plugin-tidal", "subdirectory": ""},
  "type": "input_module",
  "tier": "unofficial",
  "maturity": "experimental",
  "categories": ["tidal", "streaming", "catalog"],
  "delivery": "independent",
  "releases": [
    {
      "version": "0.1.1",
      "channel": "stable",
      "published_at": "2026-10-16T18:48:02Z",
      "source_tag": "kalinka-plugin-tidal-v0.1.1",
      "source_commit": "dfb6c8a25d0e900963b0b590f20d24332dc8193f",
      "release_notes": "https://github.com/Kalinka-Player/kalinka-plugin-tidal/releases/tag/kalinka-plugin-tidal-v0.1.1",
      "requires": {
        "server": ">=5.9.1,<6",
        "sdk": ">=3.11,<4",
        "python": ">=3.11",
        "platforms": [
          "linux"
        ],
        "architectures": [
          "x86_64",
          "aarch64"
        ],
        "capabilities": [],
        "notes": [
          "Requires Kalinka Player server 5.9.1 or newer (below 6), plugin SDK 3.11 or newer (below 4), and Python 3.11 or newer.",
          "Sign in with a TIDAL account using the browser link in plugin settings or module status. Playback requires a TIDAL streaming subscription; availability depends on the account and region.",
          "Automatically requests CD-quality lossless audio and supports direct unencrypted FLAC and MP3 streams. TIDAL Max / hi-res, segmented DASH, encrypted streams and AAC/MP4 playback are unsupported. TIDAL collections are read-only.",
          "The architecture-independent DEB is built and tested on Debian 13 and Ubuntu 24.04 for ARM64 and amd64. A compatible Debian-packaged Kalinka Player server and resolvable Python dependencies are required.",
          "This experimental integration uses the unofficial tidalapi client. Automated tests use fake API responses; live account sign-in and playback remain unverified.",
          "To change accounts, enable Forget TIDAL account on next restart in plugin settings, apply and restart, then follow the sign-in link. The switch resets automatically."
        ]
      },
      "data_rollback": "manual",
      "withdrawn": false,
      "artifacts": [
        {
          "format": "deb",
          "filename": "kalinka-plugin-tidal_0.1.1_all.deb",
          "platform": "linux",
          "architectures": [
            "all"
          ],
          "package": {
            "name": "kalinka-plugin-tidal",
            "version": "0.1.1",
            "architecture": "all"
          },
          "targets": [
            {
              "id": "debian",
              "versions": [
                "13"
              ]
            },
            {
              "id": "ubuntu",
              "versions": [
                "24.04"
              ]
            }
          ],
          "url": "https://github.com/Kalinka-Player/kalinka-plugin-tidal/releases/download/kalinka-plugin-tidal-v0.1.1/kalinka-plugin-tidal_0.1.1_all.deb",
          "sha256": "f9474fe42b087246497a86855ea3311b6a6943c8bd67e3719d8814a6ecb9bc1b",
          "size_bytes": 30228
        }
      ]
    },
    {
      "version": "0.1.0",
      "channel": "stable",
      "published_at": "2026-10-15T21:06:47Z",
      "source_tag": "kalinka-plugin-tidal-v0.1.0",
      "source_commit": "aa017f9d26c561a2b5218d99145979624d5237df",
      "release_notes": "https://github.com/Kalinka-Player/kalinka-plugin-tidal/releases/tag/kalinka-plugin-tidal-v0.1.0",
      "requires": {
        "server": ">=5.9.1,<6",
        "sdk": ">=3.11,<4",
        "python": ">=3.11",
        "platforms": ["linux"],
        "architectures": ["x86_64", "aarch64"],
        "capabilities": [],
        "notes": [
          "Requires Kalinka Player server 5.9.1 or newer (below 6), plugin SDK 3.11 or newer (below 4), and Python 3.11 or newer.",
          "Sign in with a TIDAL account using the browser link in module status. Playback requires a TIDAL streaming subscription; availability depends on the account and region.",
          "Supports direct unencrypted FLAC and MP3 streams. Segmented DASH, encrypted streams and AAC/MP4 playback are unsupported. TIDAL collections are read-only.",
          "The architecture-independent DEB is built and tested on Debian 13 and Ubuntu 24.04 for ARM64 and amd64. A compatible Debian-packaged Kalinka Player server and resolvable Python dependencies are required.",
          "This experimental integration uses the unofficial tidalapi client. Automated tests use fake API responses; live account sign-in and playback remain unverified."
        ]
      },
      "data_rollback": "manual",
      "withdrawn": false,
      "artifacts": [
        {
          "format": "deb",
          "filename": "kalinka-plugin-tidal_0.1.0_all.deb",
          "platform": "linux",
          "architectures": ["all"],
          "package": {"name": "kalinka-plugin-tidal", "version": "0.1.0", "architecture": "all"},
          "targets": [{"id": "debian", "versions": ["13"]}, {"id": "ubuntu", "versions": ["24.04"]}],
          "url": "https://github.com/Kalinka-Player/kalinka-plugin-tidal/releases/download/kalinka-plugin-tidal-v0.1.0/kalinka-plugin-tidal_0.1.0_all.deb",
          "sha256": "44eedca870fc45d6aaaed6876c44bef8e1839d7efa5d4a6ca63900e106a0ef22",
          "size_bytes": 27568
        }
      ]
    }
  ]
}
