{
  "schema_version": 1,
  "id": "dummydevice",
  "name": "Dummy Device",
  "summary": "A pretend output device for testing plugins.",
  "description": "A pretend output device that does nothing with the audio. It is for developing and testing plugins without real hardware.",
  "distribution": "kalinka-plugin-dummydevice",
  "entry_point": "kalinka_plugin_dummydevice",
  "creator": {"name": "Dmitry Savin", "url": "https://github.com/madenvel"},
  "maintainers": [{"name": "Kalinka Player", "url": "https://github.com/Kalinka-Player"}],
  "license": "GPL-3.0-or-later",
  "source": {"repository": "https://github.com/Kalinka-Player/KalinkaPlayer", "subdirectory": "packages/kalinka-plugin-dummydevice"},
  "tier": "unofficial",
  "maturity": "experimental",
  "type": "output_device",
  "device_support": {
    "models": [],
    "families": ["Kalinka Player simulated devices"],
    "notes": ["Development and testing only. This plugin simulates an output device and does not control a physical amplifier or AVR."]
  },
  "categories": ["development"],
  "delivery": "bundle",
  "releases": []
}
